module,phase,name,code,sequence,workflow-file,command,required,agent-name,agent-command,agent-display-name,agent-title,options,description,output-location,outputs
gds,4-production,Retrospective,ER,60,_bmad/gds/workflows/4-production/retrospective/workflow.md,bmad-gds-retrospective,false,game-scrum-master,bmad:- Every sprint delivers playable increments - Clean separation between design and implementation - Keep the team moving through each phase - Stories are single source of truth for implementation:agent:game-scrum-master,Max,🎯 Game Dev Scrum Master,Create Mode,Facilitate team retrospective after a game development epic is completed. Use for continuous improvement after epic completion.,implementation_artifacts,retrospective
gds,anytime,Document Project,DP,,_bmad/gds/workflows/document-project/workflow.md,bmad-gds-document-project,false,tech-writer,bmad:celebrates clarity when it shines.:agent:tech-writer,Paige,📚 Technical Writer,Create Mode,Analyze an existing game project to produce useful documentation. Use when onboarding to existing projects or creating project docs.,project_knowledge,project documentation
gds,anytime,Quick Prototype,QP,,_bmad/gds/workflows/gds-quick-flow/quick-prototype/workflow.md,bmad-gds-quick-prototype,false,game-solo-dev,bmad:PC:agent:game-solo-dev,Indie,🎮 Game Solo Dev,Create Mode,Rapid game prototyping to test mechanics and ideas quickly. Use when experimenting with gameplay concepts or validating mechanics.,,
gds,anytime,Quick Spec,TS,,_bmad/gds/workflows/gds-quick-flow/quick-spec/workflow.md,bmad-gds-quick-spec,false,game-solo-dev,bmad:PC:agent:game-solo-dev,Indie,🎮 Game Solo Dev,Create Mode,Quick one-off tasks small changes simple apps utilities without extensive planning. Use for straightforward game features or well-defined tasks.,planning_artifacts,tech spec
gds,anytime,Quick Dev,QD,,skill:gds-quick-dev,bmad-gds-quick-dev,false,game-solo-dev,bmad:PC:agent:game-solo-dev,Indie,🎮 Game Solo Dev,Create Mode,Flexible game development with game-specific considerations. Use for rapid feature implementation or mechanics work.,,
gds,anytime,Quick Dev New Preview,QQ,,_bmad/gds/workflows/gds-quick-flow/gds-quick-dev-new-preview/workflow.md,bmad-gds-quick-dev-new-preview,false,game-solo-dev,bmad:PC:agent:game-solo-dev,Indie,🎮 Game Solo Dev,Create Mode,Unified quick flow (experimental): clarify intent plan implement review and present in a single workflow.,,
gds,anytime,Correct Course,CC,,_bmad/gds/workflows/4-production/correct-course/workflow.md,bmad-gds-correct-course,false,game-scrum-master,bmad:- Every sprint delivers playable increments - Clean separation between design and implementation - Keep the team moving through each phase - Stories are single source of truth for implementation:agent:game-scrum-master,Max,🎯 Game Dev Scrum Master,Create Mode,Navigate significant changes during game dev sprint when implementation is off-track. Use when major course corrections are needed.,planning_artifacts,change proposal
gds,gametest,Test Automate,TA,10,_bmad/gds/workflows/gametest/automate/workflow.md,bmad-gds-test-automate,false,game-qa,bmad:and shipping bug-free games on console:agent:game-qa,GLaDOS,🧪 Game QA Architect,Create Mode,Generate automated game tests. Use for automated test coverage of gameplay systems.,,
gds,gametest,E2E Scaffold,ES,20,_bmad/gds/workflows/gametest/e2e-scaffold/workflow.md,bmad-gds-e2e-scaffold,false,game-qa,bmad:and shipping bug-free games on console:agent:game-qa,GLaDOS,🧪 Game QA Architect,Create Mode,Scaffold E2E testing infrastructure. Use when setting up end-to-end automated testing.,,
gds,gametest,Playtest Plan,PP,30,_bmad/gds/workflows/gametest/playtest-plan/workflow.md,bmad-gds-playtest-plan,false,game-qa,bmad:and shipping bug-free games on console:agent:game-qa,GLaDOS,🧪 Game QA Architect,Create Mode,Create structured playtesting plan. Use when planning user testing sessions or gathering player feedback.,planning_artifacts,playtest plan
gds,gametest,Performance Test,PT,40,_bmad/gds/workflows/gametest/performance/workflow.md,bmad-gds-performance-test,false,game-qa,bmad:and shipping bug-free games on console:agent:game-qa,GLaDOS,🧪 Game QA Architect,Create Mode,Design performance testing strategy. Use when optimizing game performance or profiling resource usage.,planning_artifacts,performance strategy
gds,gametest,Test Review,TR,50,_bmad/gds/workflows/gametest/test-review/workflow.md,bmad-gds-test-review,false,game-qa,bmad:and shipping bug-free games on console:agent:game-qa,GLaDOS,🧪 Game QA Architect,Create Mode,Review test quality and coverage. Use when evaluating test effectiveness or identifying coverage gaps.,,
tea,0-learning,Teach Me Testing,TMT,10,skill:bmad-teach-me-testing,bmad-tea-teach-me-testing,false,tea,bmad:backend services:agent:tea,Murat,🧪 Master Test Architect and Quality Advisor,Create Mode,Teach testing fundamentals through 7 sessions (TEA Academy),test_artifacts,progress file|session notes|certificate
tea,3-solutioning,Test Design,TD,10,skill:bmad-testarch-test-design,bmad-tea-testarch-test-design,false,tea,bmad:backend services:agent:tea,Murat,🧪 Master Test Architect and Quality Advisor,Create Mode,Risk-based test planning,test_artifacts,test design document
tea,3-solutioning,Test Framework,TF,20,skill:bmad-testarch-framework,bmad-tea-testarch-framework,false,tea,bmad:backend services:agent:tea,Murat,🧪 Master Test Architect and Quality Advisor,Create Mode,Initialize production-ready test framework,test_artifacts,framework scaffold
tea,3-solutioning,CI Setup,CI,30,skill:bmad-testarch-ci,bmad-tea-testarch-ci,false,tea,bmad:backend services:agent:tea,Murat,🧪 Master Test Architect and Quality Advisor,Create Mode,Configure CI/CD quality pipeline,test_artifacts,ci config
tea,4-implementation,ATDD,AT,10,skill:bmad-testarch-atdd,bmad-tea-testarch-atdd,false,tea,bmad:backend services:agent:tea,Murat,🧪 Master Test Architect and Quality Advisor,Create Mode,Generate failing tests (TDD red phase),test_artifacts,atdd tests
tea,4-implementation,Test Automation,TA,20,skill:bmad-testarch-automate,bmad-tea-testarch-automate,false,tea,bmad:backend services:agent:tea,Murat,🧪 Master Test Architect and Quality Advisor,Create Mode,Expand test coverage,test_artifacts,test suite
tea,4-implementation,Test Review,RV,30,skill:bmad-testarch-test-review,bmad-tea-testarch-test-review,false,tea,bmad:backend services:agent:tea,Murat,🧪 Master Test Architect and Quality Advisor,Validate Mode,Quality audit (0-100 scoring),test_artifacts,review report
tea,4-implementation,NFR Assessment,NR,40,skill:bmad-testarch-nfr,bmad-tea-testarch-nfr,false,tea,bmad:backend services:agent:tea,Murat,🧪 Master Test Architect and Quality Advisor,Create Mode,Non-functional requirements,test_artifacts,nfr report
tea,4-implementation,Traceability,TR,50,skill:bmad-testarch-trace,bmad-tea-testarch-trace,false,tea,bmad:backend services:agent:tea,Murat,🧪 Master Test Architect and Quality Advisor,Create Mode,Coverage traceability and gate,test_artifacts,traceability matrix|gate decision
wds,0-wds-agents,Wake Saga,SAGA,1,_bmad/wds/agents/saga-analyst.agent.yaml,bmad-wds-saga,false,saga-analyst,bmad:Asks questions that spark &apos;aha!&apos; moments while structuring insights with precision. Listens deeply:agent:saga-analyst,Saga,📚 WDS Analyst,Agent Activation,Agent launcher. Wakes Saga (Strategic Analyst) who handles Phases 1-2. Saga introduces herself scans attached repos for WDS projects checks phase completion status reads the design log and offers contextually appropriate next steps. Use this to start Product Brief or Trigger Map work.,,
wds,0-wds-agents,Wake Freya,FREYA,2,_bmad/wds/agents/freya-ux.agent.yaml,bmad-wds-freya,false,freya-ux,bmad:not FOR you. Starts with WHY before HOW — design without strategy is decoration. Creates artifacts developers can trust: detailed specs:agent:freya-ux,Freya,🎨 WDS Designer,Agent Activation,Agent launcher. Wakes Freya (UX Designer) who handles Phases 3-4. Freya introduces herself scans repos checks prerequisites (Product Brief + Trigger Map) detects scenario and design status and offers appropriate next steps. Use this to start UX Scenarios or UX Design work.,,
wds,0-wds-pitch,Alignment & Signoff,AS,10,_bmad/wds/workflows/0-alignment-signoff/workflow.md,bmad-wds-alignment,false,saga-analyst,bmad:Asks questions that spark &apos;aha!&apos; moments while structuring insights with precision. Listens deeply:agent:saga-analyst,Saga,📚 WDS Analyst,Create Mode,Optional. Secure stakeholder buy-in before the project starts. Create a pitch document service agreement and signoff. Use when working with clients or stakeholders who need to approve budget and scope. Skip if building your own product or working with a small trusted team.,design_artifacts/A-Product-Brief,pitch service-agreement signoff
wds,1-wds-strategy,Project Brief,PB,10,_bmad/wds/workflows/1-project-brief/workflow.md,bmad-wds-project-brief,true,saga-analyst,bmad:Asks questions that spark &apos;aha!&apos; moments while structuring insights with precision. Listens deeply:agent:saga-analyst,Saga,📚 WDS Analyst,Create Mode,Required first step. Define the product vision positioning competitive analysis and success criteria. The Project Brief is your North Star — every design decision traces back to it. Saga guides you through the five questions that anchor the entire project.,design_artifacts/A-Product-Brief,project-brief.md
wds,1-wds-strategy,Trigger Mapping,TM,20,_bmad/wds/workflows/2-trigger-mapping/workflow.md,bmad-wds-trigger-mapping,true,saga-analyst,bmad:Asks questions that spark &apos;aha!&apos; moments while structuring insights with precision. Listens deeply:agent:saga-analyst,Saga,📚 WDS Analyst,Create Mode,Required. Map business goals to user psychology through five workshops. Create personas with real driving forces and score every feature against them. This is the secret weapon of WDS — it replaces guesswork with traceable design decisions.,design_artifacts/B-Trigger-Map,trigger-map.md personas/ feature-impact-analysis.md
wds,1-wds-strategy,Platform Requirements,PR,30,_bmad/wds/workflows/1-project-brief/workflow.md,bmad-wds-platform-requirements,false,saga-analyst,bmad:Asks questions that spark &apos;aha!&apos; moments while structuring insights with precision. Listens deeply:agent:saga-analyst,Saga,📚 WDS Analyst,Create Mode,Define the technical boundaries that inform design decisions. Platforms devices integrations constraints and risks. Know your boundaries before designing within them. Recommended for complex products. Can be skipped for simple landing pages. Sub-workflow 106 under Phase 1.,design_artifacts/A-Product-Brief,platform-requirements.md
wds,2-wds-design,Outline Scenarios,OS,10,_bmad/wds/workflows/3-scenarios/workflow.md,bmad-wds-outline-scenarios,true,freya-ux,bmad:not FOR you. Starts with WHY before HOW — design without strategy is decoration. Creates artifacts developers can trust: detailed specs:agent:freya-ux,Freya,🎨 WDS Designer,Create Mode,Required. Define the user journeys you will design. Scenarios are journeys not pages — they start with a persona and a goal and end with an outcome. Each scenario connects to a driving force from the Trigger Map. This step shapes everything that follows.,design_artifacts/C-UX-Scenarios,scenario-overview.md
wds,2-wds-design,Conceptual Sketching,CS,20,_bmad/wds/workflows/4-ux-design/workflow.md,bmad-wds-conceptual-sketching,false,freya-ux,bmad:not FOR you. Starts with WHY before HOW — design without strategy is decoration. Creates artifacts developers can trust: detailed specs:agent:freya-ux,Freya,🎨 WDS Designer,Create Mode,Fast rough visual exploration before detailed specification. Multiple entry points: provide a hand sketch share inspiration let the AI generate options or discuss with Freya. The goal is direction not perfection. Recommended for complex or unfamiliar flows. Can be skipped for straightforward scenarios.,design_artifacts/C-UX-Scenarios,sketches
wds,2-wds-design,Storyboarding,SB,30,_bmad/wds/workflows/4-ux-design/workflow.md,bmad-wds-storyboarding,false,freya-ux,bmad:not FOR you. Starts with WHY before HOW — design without strategy is decoration. Creates artifacts developers can trust: detailed specs:agent:freya-ux,Freya,🎨 WDS Designer,Create Mode,Sequence the user journey through screens. Map entry points transitions success states and error paths as a visual narrative. Helps catch gaps before detailed specification. Recommended for multi-step flows. Can be skipped if the scenario is simple enough to specify directly.,design_artifacts/C-UX-Scenarios,storyboards
wds,2-wds-design,Conceptual Specifications,SP,40,_bmad/wds/workflows/4-ux-design/workflow.md,bmad-wds-conceptual-specs,true,freya-ux,bmad:not FOR you. Starts with WHY before HOW — design without strategy is decoration. Creates artifacts developers can trust: detailed specs:agent:freya-ux,Freya,🎨 WDS Designer,Create Mode,Required. The core of WDS. Document every design decision — what why how and exact content for every element on every page. Nothing is left to interpretation. The specification IS the design. Pages sections widgets elements and all their states. A developer or AI agent can build directly from this without asking questions.,design_artifacts/C-UX-Scenarios,page-specs scenario-specs
wds,2-wds-design,Functional Components,FI,50,_bmad/wds/workflows/4-ux-design/workflow.md,bmad-wds-functional-components,false,freya-ux,bmad:not FOR you. Starts with WHY before HOW — design without strategy is decoration. Creates artifacts developers can trust: detailed specs:agent:freya-ux,Freya,🎨 WDS Designer,Create Mode,Identify reusable patterns across your specifications. When the same component appears three or more times with consistent behavior extract it into a reusable definition. This grows your design system organically. Skip if using Design System Mode None.,design_artifacts/C-UX-Scenarios,component-candidates
wds,2-wds-design,Visual Design,VD,60,_bmad/wds/workflows/6-asset-generation/workflow.md,bmad-wds-visual-design,false,freya-ux,bmad:not FOR you. Starts with WHY before HOW — design without strategy is decoration. Creates artifacts developers can trust: detailed specs:agent:freya-ux,Freya,🎨 WDS Designer,Create Mode,Transform specifications into visual prototypes. Generate styled HTML prototypes from specs then refine with Figma round-trips using code.to.design or AI image generation. This is where soul enters the product. A visual designer should set the visual language — the AI applies it consistently.,design_artifacts/C-UX-Scenarios,html-prototypes visual-designs
wds,2-wds-design,Design System,DS,70,_bmad/wds/workflows/7-design-system/workflow.md,bmad-wds-design-system,false,freya-ux,bmad:not FOR you. Starts with WHY before HOW — design without strategy is decoration. Creates artifacts developers can trust: detailed specs:agent:freya-ux,Freya,🎨 WDS Designer,Create Mode,Manage your component library based on project mode: None Building Library or Existing. Components and design tokens grow organically from your design work. Each project builds on the last. Skip if using Design System Mode None.,design_artifacts/D-Design-System,components/ design-tokens.md
wds,2-wds-design,Design Delivery,DD,80,_bmad/wds/workflows/4-ux-design/workflow-handover.md,bmad-wds-design-delivery,true,freya-ux,bmad:not FOR you. Starts with WHY before HOW — design without strategy is decoration. Creates artifacts developers can trust: detailed specs:agent:freya-ux,Freya,🎨 WDS Designer,Create Mode,Required. Validate specifications are complete and package them for development as DD yaml files. Freya runs a final audit checking every element every state and accessibility. The DD contract is what developers or the agentic development phase builds from. Nothing ships without this validation.,design_artifacts/E-PRD/Design-Deliveries,delivery-package acceptance-criteria
wds,3-wds-build,Agentic Development,AD,10,_bmad/wds/workflows/5-agentic-development/workflow.md,bmad-wds-agentic-development,false,pm,bmad:and stakeholder alignment.:agent:pm,John,📋 Product Manager,Create Mode,Build iteratively with design log tracking. Design one thing build it verify with Puppeteer in the browser iterate. Every decision is logged so you can restart conversations without losing context. The agent tests its own work against acceptance criteria while you handle qualitative judgment.,_progress/agent-experiences,experience-documents
wds,3-wds-build,Acceptance Testing,AT,20,_bmad/wds/workflows/5-agentic-development/workflow-acceptance-testing.md,bmad-wds-usability-testing,false,freya-ux,bmad:not FOR you. Starts with WHY before HOW — design without strategy is decoration. Creates artifacts developers can trust: detailed specs:agent:freya-ux,Freya,🎨 WDS Designer,Create Mode,Test the product on real users using their own devices in their own environment. Plan the test scenario conduct sessions with silence and deflection then replay recordings with users for retrospective think-aloud. The Whiteport Rule: if it is not worth showing to 5 users and 1 domain expert it should not be built.,design_artifacts/F-Testing,test-results findings
wds,3-wds-build,Product Evolution,PE,30,_bmad/wds/workflows/8-product-evolution/workflow.md,bmad-wds-product-evolution,false,freya-ux,bmad:not FOR you. Starts with WHY before HOW — design without strategy is decoration. Creates artifacts developers can trust: detailed specs:agent:freya-ux,Freya,🎨 WDS Designer,Create Mode,Continuous improvement for living products. The full WDS process in miniature — receive feedback connect to Trigger Map update the spec first then project into code verify and document. Every change is tracked in the design log. Start here if you have an existing product you want to improve.,design_artifacts,updated-artifacts